Name,Country,Description,Entity Type,Sector,Team (People) 1,Team (People) 2,Team (People) 3,Team (People) 4,Partner 1 (Orgs),Partner 2 (Orgs),Partner 3 (Orgs),Partner 4 (Orgs),Partner 5 (Orgs),Partner 6 (Orgs),Url,Github,Project 1,Project 2,Project 3,Project 4,Project 5,Project 6,Project 7,Project 8,Related
Praekelt Foundation,South Africa,An African nonprofit organization dedicated to using mobile technology to improve the lives of people living in poverty.,Non Profit,Governance,Gustav Praekelt,,,,,,,,,,https://www.praekelt.org/,https://github.com/praekeltfoundation,,,,,,,,,
President's Emergency Fund for Aids Relief,"USA, Tanzania, Kenya","A United States governmental initiative to address the global HIV/AIDS epidemic and help save the lives of those suffering from the disease, primarily in Africa.",Public Agency,Health,,,,,,,,,,,,,,,,,,,,,
Public Sector Systems Strengthening (PS3),Tanzania,"A five year USAID funded project in Tanzania. The overall objective of PS3 is to strengthen the government systems at both national and local levels to improve the access, use and quality of service delivery across health, education and agriculture sectors, with a focus on the underserved populations.",Public Agency,Governance,Sarah Rosen Wartell,,,,USAID,University of Dar es Salaam,Urban Institute,,,,https://www.urban.org/public-sector-systems-strengthening-tanzania,,,,,,,,,,
RapidPro,Rwanda,RapidPro is a hosted service allowing organizations to visually build scalable interactive messaging applications.,Social Enterprise,Governance,,,,,,,,,,,https://community.rapidpro.io/about-rapidpro/,https://github.com/rapidpro,Rapid Pro,,,,,,,,
RootIO,Uganda,,Social Enterprise,Transparency,,,,,,,,,,,,,,,,,,,,,
Sahara Sparks/ Ventures,Tanzania,A project management consulting firm that manages projects and initiatives that create value to the community by addressing their key pain points,Social Enterprise,Governance,Jumanne Mtambalike,,,,Millenium Challenge Corporation,President's Emergency Fund for Aids Relief,UK Aid Direct (UKAID),Buni Innovation Hub,Commision for Science and Technology (COSTECH),Making All Voices Count,http://www.saharasparks.com,,"Hatua Project, Data Zetu, Amua Accelerator, Mawazo Challenge",,,,,,,,
She Codes for change,Tanzania,"A Tanzanian tech mentorship project aims to close the gender gap in the technology sector by educating, inspiring and equipping high school girls with the skills and tools for innovation and social change",Non Profit,Education,Abella Bateyunga,Godfrey Nyombi,Rose Funja,,Institute of International Education,Reach for Change,Tigo,Commision for Science and Technology (COSTECH),Buni Innovation Hub,,http://shecodesforchange.org/home,,,,,,,,,,
ShuleDirect Tech,Tanzania,"An organisation that provides mobile educational learning content for students and teachers in Tanzanian secondary schools via mobile app, desktop learning, and SMS.",Social Enterprise,Education,Faraja Nyalandu,,,,Tigo,Human Development Innovation Fund,,,,,http://shuledirect.info,https://github.com/ShuleDirectTech,ShuleDirect,,,,,,,,
Shuttleworth Foundation,South Africa,A small social investor that provides funding to dynamic leaders who are at the forefront of social change.,Donor / Investor,Transparency,Helen Turvey,Jason Hudson,Karien Bezuidenhout,,,,,,,,https://www.shuttleworthfoundation.org/,https://github.com/ShuttleworthFoundation,,,,,,,,,
Society of Environmental Journalists,USA,"An organization whose mission is to strengthen coverage of environment, energy, health and climate news, by supporting the journalists who report that news.",Donor / Investor,Transparency,Bobby Magill,,,,,,,,,,http://www.sej.org/,,#GreenAlert,,,,,,,,
Swedish International Development Agency (SIDA),Tanzania,"A government agency working on behalf of the Swedish parliament and government, with the mission to reduce poverty in the world.",Public Agency,Governance,Carin Jämtin,,,,,,,,,,https://www.sida.se/English/,,,,,,,,,,
Taarifa,Tanzania,"Organisation building the Taarifa Platform. An open source web API, designed to close citizen feedback loops.",Social Enterprise,Governance,,,,,,,,,,,http://taarifa.org,https://github.com/taarifa,Tanzania Waterpoints,Taarifa Platform,,,,,,,
Tanzania Bora Initiative,Tanzania,"A collaborative effort of Tanzanian individuals who share common objectives of development in social, political and economic aspects. TBI develops ICT tools and media shows for youth awareness in governance issues",Social Enterprise,Governance,Abella Bateyunga,,,,EU,Millenium Challenge Corporation,President's Emergency Fund for Aids Relief,USAID,Human Development Innovation Fund,Sahara Sparks/ Ventures,http://www.tanzaniabora.org,,"Jua Katiba, She Codes for Change, Serikali Yangu",,,,,,,,
Tanzania Open Data Portal,Tanzania,Portal established by Tanzania's government to provide civic data in a machine readable format to be used and re-used by anybody.,Public Agency,Transparency,,,,,,,,,,,http://www.opendata.go.tz,,http://www.opendata.go.tz/dataset,,,,,,,,
The Engine Room,United Kingom,"Organisation that helps activists, organisations, and other social change agents make the most of data and technology to increase their impact.",Non Profit,Governance,Alix Dunn,,,,,,,,,,https://www.theengineroom.org/,https://github.com/the-engine-room,Alidade,Diig.io,Migodiyathu,Transparent Oil Namibia,Transparent Oil Zimbabwe,,,,
The Indigo Trust,"Kenya, Tanzania, Nigeria, South Africa",Donor organisation using digital technologies to improve transparency and accountability in sub-Saharan Africa,Donor / Investor,Transparency,Fran Perrin,,,,,,,,,,https://indigotrust.org.uk,,BudgIT,Map Kibera,,,,,,,
The Open Data Institute,"United Kingdom, Tanzania","Organisation whose mission is to connect, equip and inspire people around the world to innovate with data.",Non Profit,Governance,Tim Berners-Lee,Nigel Shadbolt,,,,,,,,,https://theodi.org,,,,,,,,,,
The World Bank - Africa,"Tanzania, Kenya, Uganda","The World Bank supports Tanzania’s growth through policy analysis, grants and credits with focus on private sector and infrastructure. The World Bank has been supporting different open data initiatives in Tanzania and is currently hosting the Tanzania Open Data Initiative (TODI) and supporting initiatives such as Ramani Huria and Tandale mapping projects.",Donor / Investor,Governance,Makhtar Diop,,,,Commision for Science and Technology (COSTECH),Buni Innovation Hub,Data Zetu,IDA,IBRD,IMF,http://www.worldbank.org,,Dar Ramani Huria,World Bank Open Data,,,,,,,
They Work For You,Uganda,Organisation that mon­i­tors and re­ports on the work of the Par­lia­ment of Uganda.,Non Profit,Transparency,Jeremy Liebowitz,Joseph Munyangabo,,,Centre for Policy Analysis,,,,,,http://theyworkforyou.github.io/uganda-parliament-watch/,https://github.com/theyworkforyou,Uganda Parliament Watch,,,,,,,,
Tigo,Tanzania,A leading telecommunications company in Tanzania,Social Enterprise,Governance,Simon Karikari,,,,Commision for Science and Technology (COSTECH),Buni Innovation Hub,Reach for Change,UNICEF,,,,,Tigo Kilimo,,,,,,,,
Twaweza,"Tanzania, Kenya, Uganda","Organisation that works on enabling children to learn, citizens to exercise agency and governments to be more open and responsive in Tanzania, Kenya and Uganda. ",Non Profit,Transparency,Aidan Eyakuze,,,,Hivos,Swedish International Development Agency (SIDA),UK Aid Direct (UKAID),The World Bank,Open Government Partnership,Hewlett Foundation,https://www.twaweza.org,,"Uwezo, Sauti za Wananchi",,,,,,,,
Uganda Parliament Watch,Uganda,Par­lia­ment Watch is a non-profit or­ga­ni­za­tion that mon­i­tors and re­ports on the work of the Par­lia­ment of Uganda.,Non Profit,Transparency,Jeremy Liebowitz,Joseph Munyangabo,,,Centre for Policy Analysis,They Work For You,,,,,http://parliamentwatch.ug,,https://github.com/theyworkforyou/uganda-parliament-watch,,,,,,,,
Uhurulabs,Tanzania,An organisation that works to leverage technology and innovation for development.,Social Enterprise,Governance,Fredrick Mbuya,,,,,,,,,,,,,,,,,,,,
UK Aid Direct (UKAID),United Kingdom,"A United Kingdom initiative of the DFID that supports small and medium sized civil society organisations, based in the UK and overseas, to achieve sustained poverty reduction",Donor / Investor,Governance,David Daniels,,,,,,,,,,https://www.ukaiddirect.org,,,,,,,,,,
University of Dar es Salaam,Tanzania, The oldest and the largest University in Tanzania. ,Social Enterprise,Education,William Anangisye,,,,Millenium Challenge Corporation,President's Emergency Fund for Aids Relief,The World Bank,Buni Innovation Hub,Commision for Science and Technology (COSTECH),Code for Tanzania,https://www.udsm.ac.tz,,"D-Lab, ",,,,,,,,
US Embassy,,,,,,,,,,,,,,,,,,,,,,,,,
USAID,"Tanzania, Kenya, Uganda",An independent agency of the United States federal government that is primarily responsible for administering civilian foreign aid and development assistance,Donor / Investor,Governance,Mark Green,,,,,,,,,,https://www.usaid.gov,,,,,,,,,,
Ushahidi,Kenya,Multiple projects all available on Github,Social Enterprise,Crisis Response,Juliana Rotich,David Kobia,,,Omidyar Network,Knight Foundation,Google,USAID,iHub,,https://www.ushahidi.com/about,https://github.com/ushahidi,Ushahidi Platform,,,,,,,,
Via Water,Netherlands,Organisation that supports projects with innovative solutions for water problems facing affected African cities,Non Profit,Natural Resources,Titia Wouters,,,,,,,,,,https://www.viawater.nl,,,,,,,,,,
Vizzuality,Kenya,"Organisation of data engineers, designers, strategists and scientists creating unique tools and applications with a lasting benefit to society and the environment",Social Enterprise,Governance,Craig Mills,David Gonzalez,David Inga,,,,,,,,http://www.vizzuality.com,https://github.com/Vizzuality,Kenya Dashboard,,,,,,,,
Zye Labs,South Africa,Data science firm that develops apps & tools.,Social Enterprise,Governance,,,,,,,,,,,http://www.zyelabs.net/,https://github.com/zyelabs,,,,,,,,,
SeaSensors,Tanzania,"Sea Sensors is an acoustic data project that collects underwater blast data to help provide quantitative spatial information on the incidence of the problem over time, that will enable targeted enforcement.",Project,Natural Resources,Gill Braulik,,,,,,,,,,https://seasensors.africa/,https://github.com/CodeForAfricaLabs/sensors.AFRICA-SeaSensors,SeaSensors,SoundSort (AIPM),,,,,,,